[
  {"template_id":"WS_G1_COUNT_MAHUA","target_grade":1,"nipun_outcome_code":"FLN-M1.2","header":{"title_en":"Count Local Objects","title_hi":"स्थानीय वस्तुएँ गिनो","title_olchiki":"ᱱᱚᱰᱮᱱᱟᱜ ᱡᱤᱱᱤᱥ ᱞᱮᱠᱷᱟᱭ ᱢᱮ"},"instructions":{"text_en":"Count and circle the correct number.","text_hi":"गिनो और सही संख्या पर गोला लगाओ।","text_olchiki":"ᱞᱮᱠᱷᱟᱭ ᱢᱮ ᱟᱨ ᱥᱟᱹᱨᱤ ᱮᱞ ᱨᱮ ᱜᱩᱞ ᱢᱮ᱾"},"exercises":[{"exercise_index":1,"exercise_type":"COUNT_AND_CIRCLE","item_slots":[{"slot_id":"mahua_3","motif_key":"mahua_fruit","target_count":3,"correct_answer_olchiki":"ᱯᱮ","correct_answer_deva":"तीन","distractor_options":["ᱢᱤᱫ","ᱵᱟᱨ","ᱯᱮ"]}]}]},
  {"template_id":"WS_G2_ADD_MANGO","target_grade":2,"nipun_outcome_code":"FLN-M2.1","header":{"title_en":"Add Local Objects","title_hi":"स्थानीय वस्तुएँ जोड़ो","title_olchiki":"ᱱᱚᱰᱮᱱᱟᱜ ᱡᱤᱱᱤᱥ ᱡᱩᱲᱟᱹᱣ ᱢᱮ"},"instructions":{"text_en":"Count both groups and choose the total.","text_hi":"दोनों समूह गिनो और कुल संख्या चुनो।","text_olchiki":"ᱵᱟᱨ ᱫᱚᱞ ᱞᱮᱠᱷᱟᱭ ᱠᱟᱛᱮ ᱢᱚᱴ ᱮᱞ ᱵᱟᱪᱷᱟᱣ ᱢᱮ᱾"},"exercises":[{"exercise_index":1,"exercise_type":"OBJECT_ADDITION","item_slots":[{"slot_id":"mango_2_plus_3","motif_key":"mango_fruit","target_count":5,"correct_answer_olchiki":"ᱢᱚᱬᱮ","correct_answer_deva":"पाँच","distractor_options":["ᱯᱮ","ᱯᱩᱱ","ᱢᱚᱬᱮ"]}]}]},
  {"template_id":"WS_G3_SORT_SAL","target_grade":3,"nipun_outcome_code":"FLN-M3.1","header":{"title_en":"Sort and Match","title_hi":"छाँटो और मिलाओ","title_olchiki":"ᱵᱟᱪᱷᱟᱣ ᱟᱨ ᱢᱮᱞ ᱢᱮ"},"instructions":{"text_en":"Match each local object to its word.","text_hi":"हर स्थानीय वस्तु को उसके शब्द से मिलाओ।","text_olchiki":"ᱡᱟᱦᱟᱸ ᱱᱚᱰᱮᱱᱟᱜ ᱡᱤᱱᱤᱥ ᱫᱚ ᱤᱧ ᱨᱚᱲ ᱥᱟᱶ ᱢᱮᱞ ᱢᱮ᱾"},"exercises":[{"exercise_index":1,"exercise_type":"MATCH_THE_COLUMNS","item_slots":[{"slot_id":"sal_match","motif_key":"sal_leaf","target_count":1,"correct_answer_olchiki":"ᱥᱟᱨᱡᱚᱢ ᱥᱟᱠᱟᱢ","correct_answer_deva":"सारजोम साकाम","distractor_options":["ᱩᱞ","ᱦᱟᱹᱠᱩ","ᱥᱟᱨᱡᱚᱢ ᱥᱟᱠᱟᱢ"]}]}]}
]
